<?xml version="1.0" encoding="UTF-8" ?>
        <!ELEMENT Sqls (sql|var)>
        <!ATTLIST Sqls>
        <!ATTLIST Sqls
                class CDATA #PCDATA>
        <!ELEMENT sql (exp|#PCDATA)>
        <!ELEMENT exp (#PCDATA)>
        <!ATTLIST sql
                id CDATA #REQUIRED>
        <!ATTLIST sql
                wrap CDATA #PCDATA>
        <!ELEMENT var (#PCDATA)>
        <!ATTLIST var
                name CDATA #REQUIRED>